Topic_Code,Sub_Topic_Code,Question
AASKK405,DataTypes,What advantages do NumPy arrays offer over (nested) Python lists?
AASKK406,DataTypes,How to add values to a python array?
AASKK407,DataTypes,How to remove values to a python array?
AASKK408,DataTypes,Does Python have OOps concepts?
AASKK409,DataTypes,What is the difference between deep and shallow copy?
AASKK410,DataTypes,How is Multithreading achieved in Python?
AASKK411,DataTypes,What is the process of compilation and linking in python?
AASKK412,DataTypes,What are Python libraries? Name a few of them
AASKK413,DataTypes,What is split used for?
AASKK414,DataTypes,How to import modules in python?
AASKK415,DataTypes,Explain Inheritance in Python with an example.
AASKK416,DataTypes,How are classes created in Python? 
AASKK417,DataTypes,How to write a oneliner python code?
